{
  "schema_version": "1.0.0",
  "result_id": "2026-09-08_orin_bielik-11b-q4-llamacpp-orin_bfcl-v3_n60",
  "timestamp": "2026-09-08T11:21:16.953144+02:00",
  "manifest": {
    "git_commit": "025d450beb0e70047eeb66b3324e3708e9dc2c95",
    "git_dirty": true,
    "command": "/home/michal/dev/embedded-ai-chain/third_party/jetson-llm/.venv/bin/python scripts/validate_tool_calling.py --model-config bielik-11b-q4-llamacpp-orin --execution-condition standalone --limit 30",
    "model_config_key": "bielik-11b-q4-llamacpp-orin",
    "backend": "llama-cpp",
    "backend_version": "b5058-6bf28f01",
    "container_image": "dustynv/llama_cpp:0.3.9-r36.4.0-cu128-24.04",
    "platform": "orin",
    "target": "local"
  },
  "model": {
    "name": "speakleash/Bielik-11B-v3.0-Instruct-GGUF",
    "precision": "GGUF Q4_K_M (llama.cpp k-quant, ~4.5 bits/weight effective)",
    "backend": "llama-cpp"
  },
  "dataset": {
    "name": "BFCL",
    "version": "v3",
    "source": "gorilla-llm/Berkeley-Function-Calling-Leaderboard",
    "split": "simple+irrelevance",
    "n_available": 640,
    "n_evaluated": 60,
    "sampling_method": "first-n",
    "sampling_seed": null,
    "preprocessing_version": "v2-typefix",
    "prompt_template_version": "v1"
  },
  "protocol": {
    "scorer": "simplified-ast (this repo, not official bfcl-eval)",
    "temperature": 0.1,
    "tool_choice": "auto",
    "max_tokens": 200,
    "repetitions": 1
  },
  "scores": {
    "overall_accuracy": 0.5,
    "n": 60,
    "by_category": {
      "simple": {
        "accuracy": 0.9,
        "n": 30,
        "n_correct": 27
      },
      "irrelevance": {
        "accuracy": 0.1,
        "n": 30,
        "n_correct": 3
      }
    }
  },
  "tool_call_outcomes": {
    "confusion_matrix": {
      "true_positive": 30,
      "false_positive": 27,
      "false_negative": 0,
      "true_negative": 3
    },
    "correct_tool": 30,
    "correct_arguments": 27,
    "wrong_tool": 0,
    "hallucinated_tool": 0,
    "invalid_call": 3,
    "formatting_failure": 0,
    "server_error": 0
  },
  "notes": "tool_choice='auto' throughout - does NOT use orchestrator.py's forced tool_choice workaround, since the point is measuring unforced judgment.",
  "outcomes_file": "results/raw/2026-09-08_orin_bielik-11b-q4-llamacpp-orin_bfcl-v3_n60/outcomes.jsonl"
}